"date","isin","cusip","ticker_raw","name","sector","asset_class","mkt_val","weight","shares","price","currency","exchange","country"
"20260409","","06055HAH6","","BANK OF AMERICA CORP Variable rate","","",161956675.73,0.0259,155649000.0,1.0405,"USD","",""
"20260409","","949746804","WFC.L","Wells Fargo & Company, Series L, 7.500%","","",131477325.21,0.021,110579.0,1188.99,"USD","",""
"20260409","","06738EBX2","","BARCLAYS PLC Variable rate","","",104682800.0,0.0167,100000000.0,1.0468,"USD","",""
"20260409","","65339K837","NEE.U","NextEra Energy Capital Holdings, Inc., Series U, 6.500%, Due 06/01/2085","","",87568699.7,0.014,3473570.0,25.21,"USD","",""
"20260409","","48128BAQ4","","JPMORGAN CHASE & CO Variable rate","","",86528109.6,0.0138,82350000.0,1.0507,"USD","",""
"20260409","","98389B878","XELLL","Xcel Energy Inc., 6.25%, Due 10/15/2085","","",80925847.2,0.0129,3263139.0,24.8,"USD","",""
"20260409","","172967QJ3","","CITIGROUP INC Series HH, Variable rate","","",76788425.91,0.0123,75485000.0,1.0173,"USD","",""
"20260409","","225313AT2","","CREDIT AGRICOLE SA Variable rate","","",77109633.47,0.0123,75172000.0,1.0258,"USD","",""
"20260409","","808513BJ3","","CHARLES SCHWAB CORP Series H, Variable rate","","",68473085.29,0.011,73169000.0,0.9358,"USD","",""
"20260409","","87264A204","TMUSZ","T-Mobile USA Inc., 5.50%, Due 03/01/2070","","",67792841.82,0.0108,3112619.0,21.78,"USD","",""
"20260409","","0778FPAQ2","","BELL CANADA Variable rate, due 09/15/2055","","",67175071.18,0.0107,64644000.0,1.0392,"USD","",""
"20260409","","416515BC7","","THE HARTFORD INSUR GRP INC Variable rate, due 02/12/2047","","",67010645.46,0.0107,69648000.0,0.9621,"USD","",""
"20260409","","21871X208","CRBD","Corebridge Financial, Inc., 6.375%, Due 12/15/2064","","",66534810.72,0.0106,2828861.0,23.52,"USD","",""
"20260409","","38141GA79","","GOLDMAN SACHS GROUP INC Variable rate","","",66154994.54,0.0106,63323000.0,1.0447,"USD","",""
"20260409","","02369GAA3","","AMER AGCREDIT ACA Variable rate","","",63582442.5,0.0102,64250000.0,0.9896,"USD","",""
"20260409","","06368LQ58","","BANK OF MONTREAL Variable rate, due 05/26/2084","","",63528886.4,0.0102,60800000.0,1.0449,"USD","",""
"20260409","","233331792","DTK","DTE Energy Company, Series H, 6.25%, Due 10/01/2085","","",63031615.4,0.0101,2579035.0,24.44,"USD","",""
"20260409","","00775V104","AEFC","Aegon Funding Company LLC, 5.100%, Due 12/15/2049","","",61571170.86,0.0099,3177047.0,19.38,"USD","",""
"20260409","","05565A5R0","","BNP PARIBAS Variable rate","","",59947791.6,0.0096,56900000.0,1.0536,"USD","",""
"20260409","","05971KAQ2","","BANCO SANTANDER SA Variable rate","","",59679461.6,0.0095,50600000.0,1.1794,"USD","",""
"20260409","","29359U109","ESGRF","Enstar Group Limited, Series D, 7.000%, Variable Rate","","",59344181.05,0.0095,2631671.0,22.55,"USD","",""
"20260409","","30190A609","FGSN","F&G Annuities & Life, Inc., 7.30%, Due 01/15/2065","","",59008830.1,0.0094,2823389.0,20.9,"USD","",""
"20260409","","456837BT9","","ING GROEP NV Variable rate","","",58685782.01,0.0094,57807000.0,1.0152,"USD","",""
"20260409","","780082AV5","","ROYAL BANK OF CANADA Variable rate, due 08/24/2085","","",58985327.8,0.0094,58100000.0,1.0152,"USD","",""
"20260409","","25746UDV8","","DOMINION ENERGY INC Variable rate, due 05/15/2055","","",56720561.56,0.0091,55306000.0,1.0256,"USD","",""
"20260409","","025537BA8","","AMERICAN ELECTRIC POWER 6.95%, due 12/15/2054","","",55235916.89,0.0088,51590000.0,1.0707,"USD","",""
"20260409","","05565ASK0","","BNP PARIBAS Variable rate","","",54151562.5,0.0087,59483000.0,0.9104,"USD","",""
"20260409","","87264A303","TMUSI","T-Mobile USA Inc., 5.50%, Due 06/01/2070","","",54058012.56,0.0086,2439441.0,22.16,"USD","",""
"20260409","","53944YAV5","","LLOYDS BANKING GROUP PLC Variable rate","","",53017750.0,0.0085,50000000.0,1.0604,"USD","",""
"20260409","","404280EJ4","","HSBC HOLDINGS PLC Variable rate","","",49670407.05,0.0079,48450000.0,1.0252,"USD","",""
"20260409","","446150BG8","","HUNTINGTON BANCSHARES Variable rate","","",47367816.11,0.0076,47511000.0,0.997,"USD","",""
"20260409","","0641598V1","","BANK OF NOVA SCOTIA Variable rate, due 01/27/2084","","",46679620.68,0.0075,44149000.0,1.0573,"USD","",""
"20260409","","225313AR6","","CREDIT AGRICOLE SA Variable rate","","",45820247.07,0.0073,45578000.0,1.0053,"USD","",""
"20260409","","13607P7Y4","","CANADIAN IMPERIAL BANK Variable rate, due 10/28/2085","","",45066495.6,0.0072,44100000.0,1.0219,"USD","",""
"20260409","","89117F8Z5","","TORONTO-DOMINION BANK Variable rate, due 10/31/2082","","",44967422.0,0.0072,43430000.0,1.0354,"USD","",""
"20260409","","30190A203","FGN","F&G Annuities & Life, Inc., 7.950%, Due 12/15/2053","","",44045204.35,0.007,1782485.0,24.71,"USD","",""
"20260409","","404280DT3","","HSBC HOLDINGS PLC Variable rate","","",43020957.6,0.0069,41200000.0,1.0442,"USD","",""
"20260409","","04686J838","ATHS","Athene Holding Ltd., 7.250% Variable Rate, Due 03/30/2064","","",42533510.4,0.0068,1737480.0,24.48,"USD","",""
"20260409","","G05384204","AHL.E","Aspen Insurance Holdings Limited, 5.625%","","",41828565.41,0.0067,2058999.0,20.315,"USD","",""
"20260409","","639057AQ1","","NATWEST GROUP PLC Variable rate","","",42072225.87,0.0067,38105000.0,1.1041,"USD","",""
"20260409","","N4578ELV8","","ING GROEP NV Variable rate","","",41325450.55,0.0066,38873000.0,1.0631,"USD","",""
"20260409","","25746UEA3","","DOMINION ENERGY INC Variable rate, due 02/15/2056","","",40409063.45,0.0065,40235000.0,1.0043,"USD","",""
"20260409","","606822DP6","","MITSUBISHI UFJ FIN GRP Variable rate","","",40337586.9,0.0065,40500000.0,0.996,"USD","",""
"20260409","","693475BP9","","PNC FINANCIAL SERVICES Variable rate","","",40528530.36,0.0065,39711000.0,1.0206,"USD","",""
"20260409","","04018VAA1","","ARES FINANCE CO 4.125%, due 06/30/2051","","",39870570.12,0.0064,40400000.0,0.9869,"USD","",""
"20260409","","514666AN6","","LAND O'LAKES INC 7%","","",39725880.0,0.0064,44888000.0,0.885,"USD","",""
"20260409","","37959GAH0","","GLOBAL ATLANTIC FIN CO Variable rate, due 03/01/2056","","",39493563.52,0.0063,41076000.0,0.9615,"USD","",""
"20260409","","95002YAE3","","WELLS FARGO & COMPANY Variable rate","","",39239945.16,0.0063,38615000.0,1.0162,"USD","",""
"20260409","","0641598X7","","BANK OF NOVA SCOTIA Variable rate, due 04/27/2085","","",38810356.2,0.0062,37800000.0,1.0267,"USD","",""
"20260409","","05565AM34","","BNP PARIBAS Variable rate","","",38443329.16,0.0062,36770000.0,1.0455,"USD","",""
"20260409","","D1706CKE3","","COMMERZBANK AG Variable rate","","",38109896.0,0.0061,36800000.0,1.0356,"USD","",""
"20260409","","02557TAF6","","AMERICAN ELECTRIC POWER Variable rate, due 03/15/2056","","",36855817.83,0.0059,36830000.0,1.0007,"USD","",""
"20260409","","65339KDB3","","NEXTERA ENERGY CAPITAL Variable rate, due 06/15/2054","","",36863033.29,0.0059,35006000.0,1.053,"USD","",""
"20260409","","17327CBC6","","CITIGROUP INC Variable rate","","",36453573.15,0.0058,35958000.0,1.0138,"USD","",""
"20260409","","585270AE1","","MEIJI YASUDA LIFE INSURANCE Variable rate, due 06/11/2055","","",36539986.0,0.0058,35800000.0,1.0207,"USD","",""
"20260409","","05964HBH7","","BANCO SANTANDER SA Variable rate","","",35762762.6,0.0057,33100000.0,1.0804,"USD","",""
"20260409","","37959GAG2","","GLOBAL ATLANTIC FIN CO Variable rate, due 10/15/2054","","",35744885.31,0.0057,36675000.0,0.9746,"USD","",""
"20260409","","816851BT5","","SEMPRA Variable rate, due 10/01/2054","","",35723410.88,0.0057,35416000.0,1.0087,"USD","",""
"20260409","","83370RAC2","","SOCIETE GENERALE Variable rate","","",35663392.92,0.0057,33820000.0,1.0545,"USD","",""
"20260409","","83371GAA9","","SOCIETE GENERALE Variable rate","","",35767227.54,0.0057,32870000.0,1.0881,"USD","",""
"20260409","","04621XAK4","","ASSURANT INC Variable rate, due 03/27/2048","","",34928545.04,0.0056,34460000.0,1.0136,"USD","",""
"20260409","","780082AY9","","ROYAL BANK OF CANADA Variable rate, due 11/24/2085","","",35067300.84,0.0056,35640000.0,0.9839,"USD","",""
"20260409","","00130HCL7","","THE AES CORP Variable rate, due 07/15/2055","","",34850197.91,0.0056,36425000.0,0.9568,"USD","",""
"20260409","","00912XBQ6","","AIR LEASE CORP Variable rate","","",34143536.91,0.0055,35083000.0,0.9732,"USD","",""
"20260409","","07336UAA1","","BBVA MEX BANCA GRUPO TX Variable rate, due 06/29/2038","","",34496930.0,0.0055,31600000.0,1.0917,"USD","",""
"20260409","","14314C105","CGABL","Carlyle Finance LLC, 4.625%, Due 05/15/2061","","",34099934.95,0.0055,1954151.0,17.45,"USD","",""
"20260409","","29250NBT1","","ENBRIDGE INC Variable rate, due 01/15/2084","","",34197630.54,0.0055,30188000.0,1.1328,"USD","",""
"20260409","","04686J507","ATH.E","Athene Holding Ltd., Series E, 7.750% Variable Rate","","",32560902.88,0.0052,1316656.0,24.73,"USD","",""
"20260409","","842587EB9","","SOUTHERN CO Variable rate, due 03/15/2055","","",32195608.0,0.0052,31000000.0,1.0386,"USD","",""
"20260409","","31959XAG8","","FIRST CITIZENS BANCSHARES Series D, Variable rate","","",32175023.85,0.0051,31950000.0,1.007,"USD","",""
"20260409","","G5361WAB0","","LANCASHIRE HOLDINGS LTD Variable rate, due 09/18/2041","","",31581237.98,0.0051,32050000.0,0.9854,"USD","",""
"20260409","","65535HCC1","","NOMURA HOLDINGS INC Variable rate","","",32016847.2,0.0051,31200000.0,1.0262,"USD","",""
"20260409","","872652102","TPGXL","TPG Operating Group II, L.P., 6.950%, Due 03/15/2064","","",31829937.55,0.0051,1275749.0,24.95,"USD","",""
"20260409","","06368L5Q5","","BANK OF MONTREAL Variable rate, due 11/26/2084","","",31546538.95,0.005,30189000.0,1.045,"USD","",""
"20260409","","38141GB52","","GOLDMAN SACHS GROUP INC Variable rate","","",31271078.1,0.005,30900000.0,1.012,"USD","",""
"20260409","","404280FA2","","HSBC HOLDINGS PLC Variable rate","","",31532183.1,0.005,30900000.0,1.0205,"USD","",""
"20260409","","514666AK2","","LAND O'LAKES INC 8%","","",31147811.84,0.005,31520000.0,0.9882,"USD","",""
"20260409","","775109DH1","","ROGERS COMMUNICATIONS INC Variable rate, due 04/15/2055","","",31531102.21,0.005,30470000.0,1.0348,"USD","",""
"20260409","","04686J861","ATH.A","Athene Holding Ltd., Series A, 6.35% Variable Rate","","",30549432.0,0.0049,1272893.0,24.0,"USD","",""
"20260409","","29250NBP9","","ENBRIDGE INC Variable rate, due 01/15/2083","","",30928434.46,0.0049,28420000.0,1.0883,"USD","",""
"20260409","","05602XDJ4","","BNP PARIBAS Variable rate","","",29782261.86,0.0048,28020000.0,1.0629,"USD","",""
"20260409","","29882DAC7","","EUSHI FINANCE INC Variable rate, due 04/01/2056","","",29325239.05,0.0047,29500000.0,0.9941,"USD","",""
"20260409","","06738ECN3","","BARCLAYS PLC Variable rate","","",28527961.5,0.0046,25750000.0,1.1079,"USD","",""
"20260409","","225401AR9","","CREDIT SUISSE GROUP AG Variable rate","","",28808165.0,0.0046,81425000.0,0.3538,"USD","",""
"20260409","","008252827","MGRE","Affiliated Managers Group, Inc., 6.75%, Due 03/30/2064","","",28136319.72,0.0045,1214867.0,23.16,"USD","",""
"20260409","","14019TAA4","","CAPITAL FARM CREDIT ACA Variable rate","","",28021316.25,0.0045,28250000.0,0.9919,"USD","",""
"20260409","","857477CM3","","STATE STREET CORP Variable rate","","",28370775.27,0.0045,27247000.0,1.0412,"USD","",""
"20260409","","05946KAM3","","BANCO BILBAO VIZCAYA ARGENTARIA Variable rate","","",27522910.8,0.0044,25200000.0,1.0922,"USD","",""
"20260409","","F1876NBV3","","CNP ASSURANCES SACA Variable rate","","",27434826.09,0.0044,29400000.0,0.9332,"USD","",""
"20260409","","225401AJ7","","CREDIT SUISSE GROUP AG Variable rate","","",27207220.0,0.0044,76900000.0,0.3538,"USD","",""
"20260409","","29452E200","EQH.A","Equitable Holdings, Inc., Series A, 5.250%","","",27472660.56,0.0044,1386108.0,19.82,"USD","",""
"20260409","","025676859","ANG.D","American National Group Inc., Series D, 7.375%","","",27068662.1,0.0043,1123181.0,24.1,"USD","",""
"20260409","","05971PAE8","","BANCO MERCANTIL DEL NORTE Variable rate","","",26714523.75,0.0043,25000000.0,1.0686,"USD","",""
"20260409","","06053U601","BAC.M","Bank of America Corporation, Series KK, 5.375%","","",26655870.46,0.0043,1206694.0,22.09,"USD","",""
"20260409","","87971MCM3","","TELUS CORP Variable rate, due 10/15/2055","","",27067332.12,0.0043,26177000.0,1.034,"USD","",""
"20260409","","D18190PH1","","DEUTSCHE BANK AG Variable rate","","",26090750.23,0.0042,24800000.0,1.052,"USD","",""
"20260409","","50149XAA2","","KUVARE US HOLDINGS INC Variable rate, due 05/01/2051","","",26293419.23,0.0042,26429000.0,0.9949,"USD","",""
"20260409","","018820AE0","","ALLIANZ SE Variable rate","","",25339650.0,0.0041,25000000.0,1.0136,"USD","",""
"20260409","","17327CAV5","","CITIGROUP INC Variable rate","","",25233050.7,0.004,24700000.0,1.0216,"USD","",""
"20260409","","26441CCG8","","DUKE ENERGY CORP Variable rate, due 09/01/2054","","",25012142.38,0.004,23875000.0,1.0476,"USD","",""
"20260409","","29364GAS2","","ENTERGY CORP Variable rate, due 06/15/2056","","",24824720.25,0.004,24750000.0,1.003,"USD","",""
"20260409","","95002YAC7","","WELLS FARGO & COMPANY Variable rate","","",25023070.5,0.004,23948000.0,1.0449,"USD","",""
"20260409","","05946KAS0","","BANCO BILBAO VIZCAYA ARGENTARIA Variable rate","","",23602106.6,0.0038,22600000.0,1.0443,"USD","",""
"20260409","","05971KAP4","","BANCO SANTANDER SA Variable rate","","",23562057.6,0.0038,21600000.0,1.0908,"USD","",""
"20260409","","N4578EMC9","","ING GROEP NV Variable rate","","",23081095.8,0.0037,22200000.0,1.0397,"USD","",""
"20260409","","021361AD2","","ALTAGAS LTD Variable rate, due 10/15/2054","","",22215971.5,0.0036,21500000.0,1.0333,"USD","",""
"20260409","","05971PAB4","","BANCO MERCANTIL DEL NORTE Variable rate","","",22400432.25,0.0036,22250000.0,1.0068,"USD","",""
"20260409","","05971PAC2","","BANCO MERCANTIL DEL NORTE Variable rate","","",22613948.91,0.0036,21630000.0,1.0455,"USD","",""
"20260409","","29882DAB9","","EUSHI FINANCE INC Variable rate, due 12/15/2054","","",22512468.64,0.0036,21680000.0,1.0384,"USD","",""
"20260409","","65473PAT2","","NISOURCE INC Variable rate, due 03/31/2055","","",22558907.7,0.0036,21700000.0,1.0396,"USD","",""
"20260409","","06419GEE2","","BANK OF NOVA SCOTIA Variable rate, due 10/27/2085","","",21900628.3,0.0035,21720000.0,1.0083,"USD","",""
"20260409","","172967PM7","","CITIGROUP INC Series DD, Variable rate","","",21759503.14,0.0035,20832000.0,1.0445,"USD","",""
"20260409","","125896852","CMSC","CMS Energy Corp., 5.875%, Due 10/15/2078","","",21980800.36,0.0035,981724.0,22.39,"USD","",""
"20260409","","064058845","BK.K","The Bank of New York Mellon Corporation, Series K, Variable Rate","","",21639084.52,0.0035,852268.0,25.39,"USD","",""
"20260409","","89116C4H7","","TORONTO-DOMINION BANK Variable rate, due 10/31/2085","","",21988808.6,0.0035,22000000.0,0.9995,"USD","",""
"20260409","","514665AA6","","LAND O LAKES CAP TRST I 7.45%, Cumulative Preferred, due 03/15/2028","","",20940789.35,0.0034,20360000.0,1.0285,"USD","",""
"20260409","","674001409","OAK.B","Oaktree Capital Group, LLC, Series B, 6.55%","","",21253242.24,0.0034,1042848.0,20.38,"USD","",""
"20260409","","842587867","SOJF","The Southern Company, 6.50%, Due 03/15/2085","","",20160077.3,0.0032,796841.0,25.3,"USD","",""
"20260409","","693475BF1","","PNC FINANCIAL SERVICES Variable rate","","",19337468.31,0.0031,19095000.0,1.0127,"USD","",""
"20260409","","06738EDC6","","BARCLAYS PLC Variable rate","","",18615964.2,0.003,17900000.0,1.04,"USD","",""
"20260409","","G16249164","BPYPN","Brookfield Property Partners LP, Series A, 5.75%","","",18997143.9,0.003,1366701.0,13.9,"USD","",""
"20260409","","84857LAE1","","SPIRE INC Variable rate, due 06/01/2056","","",18617925.77,0.003,18560000.0,1.0031,"USD","",""
"20260409","","025676AR8","","AMERICAN NATIONAL GROUP Variable rate, due 12/01/2055","","",18069566.9,0.0029,18700000.0,0.9663,"USD","",""
"20260409","","0641598S8","","BANK OF NOVA SCOTIA Variable rate, due 10/27/2082","","",18044231.04,0.0029,17184000.0,1.0501,"USD","",""
"20260409","","20453QAC6","","COMPEER FINANCIAL ACA Variable rate","","",18349939.76,0.0029,17980000.0,1.0206,"USD","",""
"20260409","","225401AL2","","CREDIT SUISSE GROUP AG Variable rate","","",18317995.0,0.0029,51775000.0,0.3538,"USD","",""
"20260409","","06368L8V1","","BANK OF MONTREAL Variable rate, due 11/26/2085","","",17484972.79,0.0028,17168000.0,1.0185,"USD","",""
"20260409","","86562MDK3","","SUMITOMO MITSUI FINL GRP Variable rate","","",17505183.8,0.0028,17420000.0,1.0049,"USD","",""
"20260409","","65339KDF4","","NEXTERA ENERGY CAPITAL Variable rate, due 08/15/2055","","",16995225.0,0.0027,16250000.0,1.0459,"USD","",""
"20260409","","29103HAB3","","EMERA US FINANCE LLC Variable rate, due 10/01/2056","","",16197150.69,0.0026,16065000.0,1.0082,"USD","",""
"20260409","","48253M104","KKRS","KKR Group Finance Co. IX LLC, 4.625%, Due 04/01/2061","","",16535335.56,0.0026,1005799.0,16.44,"USD","",""
"20260409","","654579AP6","","NIPPON LIFE INSURANCE Variable rate, due 04/30/2055","","",16221826.86,0.0026,15499000.0,1.0466,"USD","",""
"20260409","","816851604","SREA","Sempra, 5.750%, Due 07/01/2079","","",16476335.04,0.0026,771364.0,21.36,"USD","",""
"20260409","","05463HAC5","","AXIS SPECIALTY FINANCE Variable rate, due 01/15/2040","","",15912544.26,0.0025,16181000.0,0.9834,"USD","",""
"20260409","","05962GAJ8","","BANCO MERCANTIL DEL NORTE Variable rate","","",15858852.6,0.0025,15700000.0,1.0101,"USD","",""
"20260409","","404280FH7","","HSBC HOLDINGS PLC Variable rate","","",15508539.2,0.0025,15400000.0,1.007,"USD","",""
"20260409","","404280FJ3","","HSBC HOLDINGS PLC Variable rate","","",15497389.6,0.0025,15400000.0,1.0063,"USD","",""
"20260409","","97650W702","WTFCN","Wintrust Financial Corporation, Series F, 7.875% Variable Rate","","",15511080.0,0.0025,596580.0,26.0,"USD","",""
"20260409","","04621X306","AIZN","Assurant, Inc., 5.250%, Due 01/15/2061","","",15201343.68,0.0024,772426.0,19.68,"USD","",""
"20260409","","00206R300","TBB","AT&T Inc., 5.350%, Due 11/01/2066","","",15097697.25,0.0024,694147.0,21.75,"USD","",""
"20260409","","13607PNF7","","CANADIAN IMPERIAL BANK Variable rate, due 01/28/2085","","",15222210.0,0.0024,15000000.0,1.0148,"USD","",""
"20260409","","12621E301","CNO.A","CNO Financial Group, Inc., 5.125%, Due 11/25/2060","","",14777943.28,0.0024,805557.0,18.345,"USD","",""
"20260409","","30040WBD9","","EVERSOURCE ENERGY Variable rate, due 08/15/2056","","",15040340.64,0.0024,15030000.0,1.0007,"USD","",""
"20260409","","693475BD6","","PNC FINANCIAL SERVICES Variable rate","","",14877933.47,0.0024,14810000.0,1.0046,"USD","",""
"20260409","","035710821","NLY.J","Annaly Capital Management, Inc., Series J, 8.875%","","",14121474.6,0.0023,549260.0,25.71,"USD","",""
"20260409","","19075QAE2","","COBANK ACB Variable rate","","",14319201.71,0.0023,14115000.0,1.0145,"USD","",""
"20260409","","20453QAA0","","COMPEER FINANCIAL ACA Variable rate","","",13733147.25,0.0022,13950000.0,0.9845,"USD","",""
"20260409","","674001300","OAK.A","Oaktree Capital Group, LLC, Series A, 6.625%","","",13812344.1,0.0022,667263.0,20.7,"USD","",""
"20260409","","G7498P127","RNR.G","RenaissanceRe Holdings Ltd., Series G, 4.200%","","",13490177.9,0.0022,859247.0,15.7,"USD","",""
"20260409","","11259P109","BEPH","Brookfield BRP Holdings (Canada) Inc., 4.625%","","",13329524.56,0.0021,891011.0,14.96,"USD","",""
"20260409","","125896845","CMSD","CMS Energy Corp., 5.875%, Due 03/01/2079","","",13156054.56,0.0021,582384.0,22.59,"USD","",""
"20260409","","19075QAF9","","COBANK ACB Variable rate","","",12841025.0,0.0021,12500000.0,1.0273,"USD","",""
"20260409","","25746UDU0","","DOMINION ENERGY INC Variable rate, due 06/01/2054","","",13321039.46,0.0021,12433000.0,1.0714,"USD","",""
"20260409","","34954WAA2","","FORTEGRA FINANCIAL CORP Variable rate, due 10/15/2057","","",13414428.98,0.0021,13700000.0,0.9792,"USD","",""
"20260409","","514666AM8","","LAND O'LAKES INC 7.25%","","",12854175.0,0.0021,14010000.0,0.9175,"USD","",""
"20260409","","857477CH4","","STATE STREET CORP Variable rate","","",12974571.96,0.0021,12536000.0,1.035,"USD","",""
"20260409","","893526681","TCPA","TransCanada Pipelines Limited, 6.25%, Due 11/01/2085","","",13283344.66,0.0021,547541.0,24.26,"USD","",""
"20260409","","008252835","MGRD","Affiliated Managers Group, Inc., 4.200%, Due 09/30/2061","","",12698237.2,0.002,857989.0,14.8,"USD","",""
"20260409","","00123Q872","AGNCP","AGNC Investment Corp., Series F, 6.125% Variable Rate","","",12609238.48,0.002,517196.0,24.38,"USD","",""
"20260409","","072912AA6","","BBVA MEX BANCA GRUPO TX Variable rate, due 02/11/2035","","",12807375.0,0.002,12300000.0,1.0413,"USD","",""
"20260409","","172967PJ4","","CITIGROUP INC Variable rate","","",12699633.33,0.002,12438000.0,1.021,"USD","",""
"20260409","","65558RAQ2","","NORDEA BANK ABP Variable rate","","",12719656.44,0.002,12520000.0,1.0159,"USD","",""
"20260409","","842587800","SOJD","The Southern Company, Series 2020, 4.950%, Due 01/30/2080","","",12519008.04,0.002,621908.0,20.13,"USD","",""
"20260409","","31769PAB6","","ASSURED GUARANTY MUNICIPAL HOLDINGS INC Variable rate, due 12/15/2066","","",12138385.75,0.0019,12699000.0,0.9559,"USD","",""
"20260409","","05890MAC7","","BANC CREDITO INVERSIONES Variable rate","","",11993709.8,0.0019,11320000.0,1.0595,"USD","",""
"20260409","","064058AR1","","BANK OF NY MELLON CORP Variable rate","","",12104489.6,0.0019,11900000.0,1.0172,"USD","",""
"20260409","","G16249156","BPYPO","Brookfield Property Partners LP, Series A2, 6.375%","","",12145145.75,0.0019,796403.0,15.25,"USD","",""
"20260409","","87264A105","TMUSL","T-Mobile USA Inc., 6.25%, Due 09/01/2069","","",11791548.0,0.0019,474700.0,24.84,"USD","",""
"20260409","","05533UAG3","","BBVA MEX BANCA GRUPO TX Variable rate, due 09/13/2034","","",11497088.28,0.0018,11600000.0,0.9911,"USD","",""
"20260409","","G16258231","BEP.A","Brookfield Renewable Partners LP, Series 17, 5.25%","","",11219253.22,0.0018,638546.0,17.57,"USD","",""
"20260409","","345370837","F.C","Ford Motor Company, 6.00%, Due 12/01/2059","","",11319273.48,0.0018,565116.0,20.03,"USD","",""
"20260409","","379378300","GNL.A","Global Net Lease, Inc., Series A, 7.25%","","",11108461.56,0.0018,493052.0,22.53,"USD","",""
"20260409","","780082AT0","","ROYAL BANK OF CANADA Variable rate, due 11/24/2084","","",11014737.44,0.0018,11356000.0,0.9699,"USD","",""
"20260409","","G05384162","AHL.D","Aspen Insurance Holdings Limited, 5.625%","","",10625052.98,0.0017,515279.0,20.62,"USD","",""
"20260409","","00206R706","T.C","AT&T Inc., Series C, 4.750%","","",10725808.73,0.0017,567203.0,18.91,"USD","",""
"20260409","","11276B109","BIPH","Brookfield Infrastructure Finance ULC, 5.00%, Due 05/24/2081","","",10455880.45,0.0017,659677.0,15.85,"USD","",""
"20260409","","G16252267","BIP.A","Brookfield Infrastructure Partners LP, Series 13, 5.125%","","",10516227.56,0.0017,616426.0,17.06,"USD","",""
"20260409","","23385HAA7","","DAIRY FARMERS OF AMERICA 7.125%","","",10708881.0,0.0017,10700000.0,1.0008,"USD","",""
"20260409","","404280EH8","","HSBC HOLDINGS PLC Variable rate","","",10552276.86,0.0017,10380000.0,1.0166,"USD","",""
"20260409","","48128B549","JPM.L","JPMorgan Chase & Co., Series LL, 4.625%","","",10367316.8,0.0017,533024.0,19.45,"USD","",""
"20260409","","035710870","NLY.F","Annaly Capital Management, Inc., Series F, 6.950%, Variable Rate","","",9773798.4,0.0016,381789.0,25.6,"USD","",""
"20260409","","25401T405","DBRG.I","DigitalBridge Group, Inc., Series I, 7.15%","","",9842936.64,0.0016,598173.0,16.455,"USD","",""
"20260409","","345370811","F.D","Ford Motor Company, 6.500%, Due 08/15/2062","","",9972309.18,0.0016,462967.0,21.54,"USD","",""
"20260409","","38141GC28","","GOLDMAN SACHS GROUP INC Variable rate","","",10077580.65,0.0016,9736000.0,1.0351,"USD","",""
"20260409","","61762V838","MS.Q","Morgan Stanley, Series Q, 6.625%","","",10178215.21,0.0016,398053.0,25.57,"USD","",""
"20260409","","05602XJC3","","BNP PARIBAS Variable rate","","",9621761.4,0.0015,9300000.0,1.0346,"USD","",""
"20260409","","225401AX6","","CREDIT SUISSE GROUP AG Variable rate","","",9623360.0,0.0015,27200000.0,0.3538,"USD","",""
"20260409","","29103HAA5","","EMERA US FINANCE LLC Variable rate, due 10/01/2056","","",9330761.75,0.0015,9250000.0,1.0087,"USD","",""
"20260409","","30040WBC1","","EVERSOURCE ENERGY Variable rate, due 08/15/2056","","",9270950.52,0.0015,9300000.0,0.9969,"USD","",""
"20260409","","539439BF5","","LLOYDS BANKING GROUP PLC Variable rate","","",9129796.98,0.0015,9300000.0,0.9817,"USD","",""
"20260409","","759351AV1","","REINSURANCE GRP OF AMER Variable rate, due 09/15/2056","","",9117724.65,0.0015,9300000.0,0.9804,"USD","",""
"20260409","","00123Q831","AGNCZ","AGNC Investment Corp., Series H, 8.75%","","",8871371.7,0.0014,355566.0,24.95,"USD","",""
"20260409","","05461T305","AXS.E","AXIS Capital Holdings Limited, Series E, 5.500%","","",8858797.89,0.0014,451749.0,19.61,"USD","",""
"20260409","","05565AS20","","BNP PARIBAS Variable rate","","",8753196.6,0.0014,8300000.0,1.0546,"USD","",""
"20260409","","87971MCL5","","TELUS CORP Variable rate, due 10/15/2055","","",8819097.35,0.0014,8681000.0,1.0159,"USD","",""
"20260409","","65339K829","NEE.W","NextEra Energy Capital Holdings, Inc., Series Z, 6.50%, Due 04/15/2086","","",8047307.0,0.0013,322150.0,24.98,"USD","",""
"20260409","","00123Q609","AGNCM","AGNC Investment Corp., Series D, 6.875% Variable Rate","","",7293984.45,0.0012,300535.0,24.27,"USD","",""
"20260409","","12542R704","CHSCM","CHS Inc., Series 3, 6.750%, Variable Rate","","",7740355.23,0.0012,312237.0,24.79,"USD","",""
"20260409","","30767EAC3","","FARM CREDIT BK OF TEXAS Variable rate","","",7581915.0,0.0012,7650000.0,0.9911,"USD","",""
